{
  "$schema": "http://json-schema.org/draft-07/schema#",
  "title": "Authord Settings",
  "type": "object",
  "properties": {
    "schema": {
      "type": "string",
      "description": "Schema identifier."
    },
    "title": {
      "type": "string",
      "description": "Title of the configuration."
    },
    "type": {
      "type": "string",
      "description": "Type of this configuration."
    },
    "topics": {
      "type": "object",
      "properties": {
        "dir": {
          "type": "string",
          "description": "Specify the directory where topic files are located."
        }
      },
      "additionalProperties": false
    },
    "images": {
      "$ref": "#/definitions/images"
    },
    "instances": {
      "type": "array",
      "items": {
        "$ref": "#/definitions/instance"
      }
    },
    "file-paths": {
      "type": "object",
      "description": "Dictionary mapping IDs to file paths.",
      "additionalProperties": {
        "type": "string"
      }
    }
  },
  "additionalProperties": false,
  "definitions": {
    "images": {
      "type": "object",
      "properties": {
        "dir": {
          "type": "string",
          "description": "Specify the directory where image files are stored."
        },
        "version": {
          "type": "string",
          "description": "Specify the image set version."
        },
        "web-path": {
          "type": "string",
          "description": "Specify the web path where images should be stored after building."
        }
      },
      "additionalProperties": false
    },
    "instance": {
      "type": "object",
      "description": "Inline instance profile definition.",
      "properties": {
        "id": {
          "type": "string",
          "description": "Unique identifier for the instance profile."
        },
        "name": {
          "type": "string",
          "description": "Name of the instance profile."
        },
        "start-page": {
          "type": "string",
          "description": "Start page for the instance profile."
        },
        "toc-elements": {
          "type": "array",
          "description": "Array of table-of-contents elements.",
          "items": {
            "$ref": "#/definitions/tocElement"
          }
        }
      },
      "additionalProperties": false
    },
    "tocElement": {
      "type": "object",
      "properties": {
        "id": {
          "type": "string",
          "description": "Unique identifier for the TOC element."
        },
        "topic": {
          "type": "string",
          "description": "Topic file associated with this TOC element."
        },
        "path": {
          "type": "string",
          "description": "Path to the element."
        },
        "toc-title": {
          "type": "string",
          "description": "Title displayed in the table of contents."
        },
        "sort-children": {
          "type": "string",
          "enum": ["ascending", "descending", "none"],
          "default": "none",
          "description": "Sorting order for child elements."
        },
        "children": {
          "type": "array",
          "description": "Child TOC elements.",
          "items": {
            "$ref": "#/definitions/tocElement"
          }
        }
      },
      "additionalProperties": false
    }
  }
}